{
  "$schema": "https://json-schema.org/draft/2020-12/schema",
  "$id": "switch-comparison/family.schema.json",
  "title": "Switch family",
  "description": "One product family from one vendor, with every orderable model in it. Values come from the vendor datasheet named in `source`.",
  "type": "object",
  "required": ["id", "vendor", "family", "source", "stacking", "routing", "routeScale", "macTable", "macsec", "buffer", "power", "fansFieldReplaceable", "licensing", "models"],
  "properties": {
    "id": { "type": "string", "pattern": "^[a-z0-9]+$" },
    "vendor": { "type": "string" },
    "family": { "type": "string" },
    "role": {
      "enum": ["access", "aggregation"],
      "description": "Campus role. Defaults to access. Aggregation covers distribution and core fabric lines (for example Catalyst 9500, CX 8325). Browse can filter on this; the closet sizer only considers access models with copper or fiber access ports."
    },
    "source": { "type": "string", "description": "Key into data/sources.json" },
    "stacking": {
      "type": "object",
      "required": ["tech", "bandwidthGbps", "maxMembers", "frontPanel", "note"],
      "properties": {
        "tech": { "type": "string" },
        "bandwidthGbps": { "type": ["number", "null"] },
        "maxMembers": { "type": ["integer", "null"], "description": "1 when not stackable; null when there is no hardware stack but switches are managed as a fabric (for example FortiLink)" },
        "frontPanel": { "type": "boolean", "description": "true when stacking consumes front uplink ports (for example Aruba VSF)" },
        "note": { "type": "string" }
      }
    },
    "mlag": {
      "type": "object",
      "description": "Optional. Present when the family can form a two-switch multichassis LAG pair (MLAG, MCLAG, VSX, StackWise Virtual, and similar). Absent means unknown or not supported.",
      "required": ["tech", "note"],
      "properties": {
        "tech": { "type": "string" },
        "note": { "type": "string" }
      }
    },
    "routing": {
      "type": "object",
      "required": ["tier", "bgp", "summary"],
      "properties": {
        "tier": { "enum": ["l2", "ospf", "full"] },
        "bgp": { "type": "boolean" },
        "summary": { "type": "string" }
      }
    },
    "routeScale": { "type": "string", "description": "As the vendor states it. Not normalized." },
    "macTable": { "type": "string" },
    "macsec": { "type": "string" },
    "buffer": { "type": "string" },
    "power": {
      "type": "object",
      "required": ["summary", "psuFieldReplaceable", "redundancy"],
      "properties": { "summary": { "type": "string" }, "psuFieldReplaceable": { "type": "boolean" }, "redundancy": { "$ref": "#/$defs/redundancy" } }
    },
    "fansFieldReplaceable": { "type": "boolean" },
    "licensing": { "type": "string" },
    "additionalSources": { "type": "array", "items": { "type": "string" }, "description": "Further keys into data/sources.json, for vendor documents that supply values the primary source does not" },
    "verify": { "type": "array", "items": { "type": "string" }, "description": "Family-level fields that still need confirming (for example stacking, mlag, routeScale)" },
    "verifyNote": { "type": "string", "description": "Why the family-level fields are flagged" },
    "modelingLimitation": { "type": "boolean", "description": "true when the family flag describes something the schema cannot represent rather than missing or conflicting data. Needs verify and verifyNote. Listed under Known modeling limitations instead of the active Needs checking count" },
    "lifecycle": { "$ref": "#/$defs/lifecycle", "description": "Family-wide lifecycle state. A model's own lifecycle overrides it" },
    "ruggedized": { "type": "boolean", "description": "Family default. Overridden per model" },
    "operatingTempC": { "$ref": "#/$defs/tempRange", "description": "Family default. Overridden per model" },
    "ipRating": { "type": "string", "description": "Family default, for example IP30. Overridden per model" },
    "mounting": { "$ref": "#/$defs/mounting", "description": "Family default. Overridden per model" },
    "models": { "type": "array", "minItems": 1, "items": { "$ref": "#/$defs/model" } }
  },
  "$defs": {
    "lifecycle": {
      "type": "object",
      "description": "Where the product is in its sales and support life. Absent means current.",
      "required": ["status"],
      "properties": {
        "status": { "enum": ["current", "endOfSale", "endOfSupport"], "description": "current: still orderable. endOfSale: no longer orderable but still supported. endOfSupport: past the last day of support" },
        "endOfSaleDate": { "type": "string", "pattern": "^\\d{4}-\\d{2}-\\d{2}$", "description": "Last day the vendor accepts orders. Required once status is endOfSale or endOfSupport" },
        "endOfSupportDate": { "type": "string", "pattern": "^\\d{4}-\\d{2}-\\d{2}$", "description": "Last day of vendor support" },
        "announcementUrl": { "type": "string", "description": "The vendor's own end-of-life notice" },
        "replacement": { "type": "array", "items": { "type": "string" }, "description": "SKUs or family ids the vendor names as the successor. Only when the vendor names one" },
        "note": { "type": "string" }
      }
    },
    "tempRange": {
      "type": "object",
      "description": "Operating temperature range in degrees Celsius, as the datasheet states it",
      "required": ["min", "max"],
      "properties": { "min": { "type": "number" }, "max": { "type": "number" } }
    },
    "mounting": {
      "type": "array",
      "minItems": 1,
      "description": "Every mounting method the datasheet lists",
      "items": { "enum": ["rack", "desktop", "wall", "din"] }
    },
    "redundancy": {
      "type": "object",
      "required": ["supported", "detail"],
      "description": "Whether a second power supply (or built-in redundant input) is available, and how it is provided",
      "properties": {
        "supported": { "type": "boolean" },
        "detail": { "type": "string", "description": "How redundancy is delivered: built in, included, or sold separately; internal or external" }
      }
    },
    "model": {
      "type": "object",
      "required": ["sku", "accessPorts", "poeBudgets", "switchingGbps", "forwardingMpps"],
      "properties": {
        "sku": { "type": "string" },
        "source": { "type": "string", "description": "Overrides the family source when a model has its own datasheet" },
        "description": { "type": "string" },
        "accessPorts": {
          "type": "array",
          "minItems": 0,
          "description": "PoE-bearing access ports at 25G and below. Empty on pure fabric/aggregation models. One entry per group of identical ports",
          "items": {
            "type": "object",
            "required": ["count", "speedGbps", "poeWatts"],
            "properties": {
              "count": { "type": "integer", "minimum": 1 },
              "speedGbps": { "enum": [1, 2.5, 5, 10, 25] },
              "media": { "enum": ["rj45", "sfp"], "description": "Defaults to rj45 (copper)" },
              "poeWatts": { "type": "number", "minimum": 0, "description": "Per-port maximum. 0 for no PoE" }
            }
          }
        },
        "fabricPorts": {
          "type": "array",
          "minItems": 0,
          "description": "High-speed ports above 25G (aggregation fabric). Never carry PoE. Empty or omitted when the model has none",
          "items": {
            "type": "object",
            "required": ["count", "speedGbps"],
            "properties": {
              "count": { "type": "integer", "minimum": 1 },
              "speedGbps": { "enum": [40, 50, 100, 200, 400] },
              "media": { "enum": ["sfp", "qsfp", "qsfp-dd"], "description": "Defaults to qsfp" }
            }
          }
        },
        "uplinks": { "type": "string", "description": "Key into data/uplinks.json. Omit on all-fabric switches that have no separate uplink module" },
        "poeBudgets": {
          "type": "array",
          "description": "Available PoE for each power supply configuration the datasheet lists, smallest first",
          "items": {
            "type": "object",
            "required": ["config", "watts"],
            "properties": {
              "config": { "type": "string" },
              "watts": { "type": "number", "exclusiveMinimum": 0 },
              "verify": { "type": "boolean" }
            }
          }
        },
        "switchingGbps": { "type": ["number", "null"], "description": "null when the datasheet does not publish it" },
        "forwardingMpps": { "type": ["number", "null"] },
        "formFactor": { "enum": ["1RU", "1.2RU", "2RU", "Compact", "Desktop"], "description": "Defaults to 1RU" },
        "fanless": { "type": "boolean" },
        "poweredBy": { "type": "string", "description": "For switches that can be powered over PoE or by an adapter" },
        "routeScale": { "type": "string", "description": "Overrides the family value" },
        "macTable": { "type": "string", "description": "Overrides the family value" },
        "buffer": { "type": "string", "description": "Overrides the family value" },
        "redundancy": { "$ref": "#/$defs/redundancy", "description": "Overrides the family value" },
        "lifecycle": { "$ref": "#/$defs/lifecycle", "description": "Overrides the family value" },
        "ruggedized": { "type": "boolean", "description": "Built for extended temperature, dust, or vibration. Overrides the family value" },
        "operatingTempC": { "$ref": "#/$defs/tempRange", "description": "Overrides the family value" },
        "ipRating": { "type": "string", "description": "Overrides the family value, for example IP30" },
        "mounting": { "$ref": "#/$defs/mounting", "description": "Overrides the family value" },
        "note": { "type": "string" },
        "verify": { "type": "array", "items": { "type": "string" } },
        "verifyNote": { "type": "string" },
        "modelingLimitation": { "type": "boolean", "description": "true when the model flag describes something the schema cannot represent rather than missing or conflicting data. Needs a flag and verifyNote. Listed under Known modeling limitations instead of the active Needs checking count" }
      }
    },
    "accessoryPart": {
      "type": "object",
      "description": "One optic, DAC/AOC, or stacking cable. Values come from the vendor source on the parent catalog file.",
      "required": ["sku", "category", "speedGbps", "formFactor", "media", "distanceM"],
      "properties": {
        "sku": { "type": "string" },
        "category": { "enum": ["transceiver", "dac", "aoc", "stacking"] },
        "speedGbps": {
          "type": ["number", "null"],
          "description": "1, 10, 20, 25, 40, 50, 100, 120, or 400. Null for stack-fabric cables and kits with no rated data rate."
        },
        "formFactor": {
          "enum": ["SFP", "SFP+", "SFP28", "SFP56", "QSFP+", "QSFP28", "QSFP56", "QSFP-DD", "SFP-DD", "StackWise-480", "StackWise-160", "Stack", "Kit"]
        },
        "reach": {
          "enum": ["SR", "LR", "LRM", "ER", "SX", "LX", "LX/LH", "LH", "LX40", "FX", "T", "SR4", "LR4", "USR", "ZR", "BiDi", "CWDM"],
          "description": "Required on transceivers. Omit on DAC, AOC, and stacking. Values follow the vendor's own reach labels."
        },
        "media": { "enum": ["MMF", "SMF", "Copper", "DAC", "AOC", "Stack", "Kit"] },
        "distanceM": {
          "type": "number",
          "minimum": 0,
          "description": "Reach in metres. 0 for kits. Fractional values allowed (for example 0.5 or 0.65)."
        },
        "verified": {
          "type": "boolean",
          "description": "true when the SKU is traced to a vendor datasheet or matrix. false when it still needs confirming. Unverified parts stay in Accessories listings without a check tag, and appear on the Needs checking page."
        },
        "appliesTo": {
          "type": "array",
          "items": { "type": "string" },
          "description": "Optional family IDs this part applies to. Absent means every family of that vendor (typical for optics/DACs/AOCs). Present means only those families (typical for stacking cables/kits). An empty array means the part stays in the vendor catalog but appears on no switch detail view."
        },
        "note": { "type": "string" }
      }
    },
    "accessoryCatalog": {
      "type": "object",
      "description": "Per-vendor accessory shortlist. The full matrix stays behind opticsMatrixUrl.",
      "required": ["vendor", "source", "opticsMatrixUrl", "parts"],
      "properties": {
        "vendor": { "type": "string" },
        "source": { "type": "string", "description": "Key into data/sources.json" },
        "opticsMatrixUrl": { "type": "string", "description": "Vendor optics compatibility or transceiver guide" },
        "note": { "type": "string" },
        "parts": { "type": "array", "minItems": 1, "items": { "$ref": "#/$defs/accessoryPart" } }
      }
    }
  }
}
