{
  "id": "f400",
  "vendor": "Fortinet",
  "family": "FortiSwitch 400E",
  "source": "fcam",
  "mlag": {
    "tech": "MCLAG",
    "note": "Two FortiSwitch units form an active/active MCLAG pair (maximum two; same model and firmware recommended). Supported with FortiLink MCLAG peer groups and in standalone mode. Layer-3 routing inside the MCLAG is limited to VRRP and static routes"
  },
  "stacking": {
    "tech": "FortiLink",
    "bandwidthGbps": null,
    "maxMembers": null,
    "frontPanel": false,
    "note": "No hardware stacking. A FortiGate manages 8 to 300 switches (model dependent) as one fabric with automatic inter-switch links"
  },
  "routing": {
    "tier": "full",
    "bgp": true,
    "summary": "Static; OSPF, RIP, VRRP, BGP (BGP from FortiSwitchOS 7.2.0); dynamic routing needs the Advanced Features license"
  },
  "routeScale": "1,000 IPv4 routes, 5,000 host entries",
  "macTable": "16,000",
  "macsec": "Per feature matrix",
  "buffer": "2 MB",
  "power": {
    "summary": "Built-in redundant AC inputs",
    "psuFieldReplaceable": false,
    "redundancy": {
      "supported": true,
      "detail": "Built-in redundant AC inputs. Nothing extra to buy for the second input."
    }
  },
  "fansFieldReplaceable": false,
  "licensing": "No license needed when managed by a FortiGate over FortiLink. Dynamic routing needs the Advanced Features license (FS-SW-LIC-xxx). Cloud or standalone management is a separate subscription",
  "models": [
    {
      "sku": "FS-424E-Fiber",
      "accessPorts": [
        {
          "count": 24,
          "speedGbps": 1,
          "poeWatts": 0,
          "media": "sfp"
        }
      ],
      "uplinks": "x4",
      "poeBudgets": [],
      "switchingGbps": 128,
      "forwardingMpps": 190,
      "routeScale": "16,000 IPv4 / 8,000 IPv6",
      "macTable": "32,000",
      "buffer": "4 MB"
    },
    {
      "sku": "FS-424E-FPOE",
      "accessPorts": [
        {
          "count": 24,
          "speedGbps": 1,
          "poeWatts": 30
        }
      ],
      "uplinks": "x4",
      "poeBudgets": [
        {
          "config": "Internal",
          "watts": 421
        }
      ],
      "switchingGbps": 128,
      "forwardingMpps": 190
    },
    {
      "sku": "FS-M426E-FPOE",
      "accessPorts": [
        {
          "count": 16,
          "speedGbps": 1,
          "poeWatts": 30
        },
        {
          "count": 8,
          "speedGbps": 2.5,
          "poeWatts": 60
        },
        {
          "count": 2,
          "speedGbps": 5,
          "poeWatts": 0
        }
      ],
      "uplinks": "x4",
      "poeBudgets": [
        {
          "config": "Internal",
          "watts": 420
        }
      ],
      "switchingGbps": 172,
      "forwardingMpps": 255,
      "note": "The two 5G ports have no PoE. Ordering description lists 421W"
    }
  ],
  "additionalSources": [
    "fsos720",
    "fsos766matrix",
    "fsmclag"
  ]
}
