{
  "id": "jex4100f",
  "vendor": "Juniper",
  "family": "EX4100-F",
  "source": "jex4100f",
  "stacking": {
    "tech": "Virtual Chassis",
    "bandwidthGbps": 80,
    "maxMembers": 10,
    "frontPanel": true,
    "note": "Stacks over the 4x 10G SFP+ VC/uplink ports, which can be reconfigured as uplinks. Mixes with any EX4100-F model"
  },
  "routing": {
    "tier": "full",
    "bgp": true,
    "summary": "RIP, OSPF, BGP, IS-IS, VRF-lite, EVPN-VXLAN. OSPF and BGP need a Flex license"
  },
  "routeScale": "32,650 IPv4 unicast prefixes, 32,150 host routes; 16,200 IPv6 prefixes",
  "macTable": "64,000",
  "macsec": "Listed under access security; cipher and licensing not stated",
  "buffer": "Not published",
  "power": {
    "summary": "Fixed internal PSU (24 and 48-port); external adapter (12-port)",
    "psuFieldReplaceable": false,
    "redundancy": {
      "supported": false,
      "detail": "Fixed internal PSU; no redundant option"
    }
  },
  "fansFieldReplaceable": false,
  "licensing": "Juniper Flex: Standard features included. OSPF and BGP need a Flex Advanced or Premium license (perpetual or 1, 3, or 5-year subscription, priced by port class); subscriptions include Mist Wired Assurance",
  "verify": [
    "macsec"
  ],
  "models": [
    {
      "sku": "EX4100-F-12T",
      "accessPorts": [
        {
          "count": 12,
          "speedGbps": 1,
          "poeWatts": 0
        }
      ],
      "uplinks": "jex4100f12",
      "poeBudgets": [],
      "switchingGbps": 144,
      "forwardingMpps": 107,
      "formFactor": "Compact",
      "fanless": true,
      "poweredBy": "External 75W AC adapter (EX4100-F-PWR-75W); uplinks can also take PoE from an upstream switch",
      "redundancy": {
        "supported": false,
        "detail": "External adapter; no redundant adapter option"
      }
    },
    {
      "sku": "EX4100-F-12P",
      "accessPorts": [
        {
          "count": 12,
          "speedGbps": 1,
          "poeWatts": 30
        }
      ],
      "uplinks": "jex4100f12",
      "poeBudgets": [
        {
          "config": "External 280W adapter",
          "watts": 180
        },
        {
          "config": "Adapter + one uplink on 90W upstream PoE",
          "watts": 240
        },
        {
          "config": "Adapter + both uplinks on 90W upstream PoE",
          "watts": 300
        }
      ],
      "switchingGbps": 144,
      "forwardingMpps": 107,
      "formFactor": "Compact",
      "fanless": true,
      "poweredBy": "External 280W AC adapter (EX4100-F-PWR-280W); each mGig uplink can add 90W from an upstream PoE switch",
      "redundancy": {
        "supported": false,
        "detail": "External adapter; upstream PoE on the uplinks adds PoE budget"
      },
      "note": "The 240W figure comes from the Juniper EX Series PoE user guide"
    },
    {
      "sku": "EX4100-F-24T",
      "accessPorts": [
        {
          "count": 24,
          "speedGbps": 1,
          "poeWatts": 0
        }
      ],
      "uplinks": "jex4100f",
      "poeBudgets": [],
      "switchingGbps": 208,
      "forwardingMpps": 154
    },
    {
      "sku": "EX4100-F-24P",
      "accessPorts": [
        {
          "count": 24,
          "speedGbps": 1,
          "poeWatts": 30
        }
      ],
      "uplinks": "jex4100f",
      "poeBudgets": [
        {
          "config": "Internal",
          "watts": 370
        }
      ],
      "switchingGbps": 208,
      "forwardingMpps": 154
    },
    {
      "sku": "EX4100-F-48T",
      "accessPorts": [
        {
          "count": 48,
          "speedGbps": 1,
          "poeWatts": 0
        }
      ],
      "uplinks": "jex4100f",
      "poeBudgets": [],
      "switchingGbps": 256,
      "forwardingMpps": 190
    },
    {
      "sku": "EX4100-F-48P",
      "accessPorts": [
        {
          "count": 48,
          "speedGbps": 1,
          "poeWatts": 30
        }
      ],
      "uplinks": "jex4100f",
      "poeBudgets": [
        {
          "config": "Internal",
          "watts": 740
        }
      ],
      "switchingGbps": 256,
      "forwardingMpps": 190
    }
  ],
  "verifyNote": "MACsec listed in the data sheet; cipher and per-model support not stated"
}
